743;LIGA DE AMAS DE CASA CONSUMIDORES Y USUARIOS DE LA REPUBLICA ARGENTINA;01/01/1994;43 N° 315 E/ 1 Y 2 / Enviar Correspondencia a: 31 N° 47 E/ 32 Y 531;C. URBANO NORTE;Usuarios y Consumidores;2;1900;427-0916 / 423-3006;;;7 de Abril 1995;;;317/97;;814;;;;;ROSANNA RIZZI TEL: 484-2714;1994-1995;;;;X;;
744;CENTRO RECREATIVO INFANTIL BARRIO MONASTERIO;01/01/1995;13 Y 82;VILLA ELVIRA;Deportes en general;8;1900;;;;octubre 14 de 1985;;L: 38906 / M: 5768;293/97;;815;;;;;DE BLASIS RODOLFO;1995;;X;;X;;
745;ASOCIACION CIVIL COMIENZOS;01/01/2005;83 Y 8 BIS Casa N° 195;VILLA ELVIRA;Asistencia Infancia y Adolescencia;8;1900;;;;agosto 24 de 1989;;L: 52072 / M: 10142;494/97;;816;;;;;RAUL ALBERTO SOSA;2005;;;;X;;
746;FUENTE DE VIDA;01/01/1999;54 N° 777 E/ 10 Y 11 / 62 N° 218;C. URBANO SUR;Asistencia Familiar;1;1900;425-9951;;;octubre 20 de 1995;;L: 79429 / M: 15091;754/97;;817;;;;;CARLOS LEGUIZAMON TEL: 483-7724;1999;;X;;X;;
747;CIRCULO PLATENSE DE CANARICULTURA;01/01/2008;27 N° 884 E/ 49 Y 50;C. URBANO ESTE;Vida Animal;4;1900;453-1516;CPCLP@hotmail.com;;17 de Abril 1977;;L: 66044 / M: 12698;834/97;;818;;;;;JOSÉ MORBELLI (TEL del Cdor. 15-5082410 / 453-1516);2007-2008;31 de julio;X;;X;;
748;FUNDACION ROLANDO A. ZANETTA;01/01/2007;68 N° 1541;C. URBANO SUR;Promoción y Fomento;5;1900;453-3397;;;junio 8 de 1993;;L: 67280 / M: 12694;1056/97;;819;;;;;MERCEDES GRACIELA ZANETTA TEL: 453 - 3397;2006-2007;31 de marzo;;;X;;
749;COMISION DE AYUDA A ESCUELAS ARGENTINAS ( CAESA );01/01/2016;(ACTUALMENTE FUNCIONA EL CTRO. DE FTO. 9 DE JULIO);C. URBANO ESTE;Emergencias, Catástrofes y Prevención;8;1900;452-8802/475-0495/425-2731;caesalaplata@hotmail.com /;;Año 1989;15/03/1989;L: 74976 / M: 14389;1137/97;;820;;;;;MERCEDES PISTARINO TEL:;2016;31 de diciembre;;;X;;
750;ASOCIACION SOCIAL COMUNITARIA DE INTEGRIDAD POPULAR ( A.S.C.I.P. );01/01/2005;48 Nº 633 E/ 7 Y 8 OFICINA: 801 / 802;C. URBANO SUR;Promoción y Fomento;9;1900;483-6318;ascip17@yahoo.com.ar;;marzo 20 de 1995;;L: 76925 / M: 14592;326/98;;821;;;;;LABARTHE ELISA MONICA TEL: 473-1413;2005;;;;X;;
751;CIRCULO AMIGOS DE LA TERCERA EDAD ACTIVA;01/01/2016;473A Nº 1676 E/ 21A Y CNO. GRAL BELGRANO;CITY BELL;Actividades y terapias recreativas;10;1896;;;;junio 8 de 1990;;L: 51281 / M: 971;1154/97;;822;SI;;;;OMAR RIVERO 480-2753 TESORERO OMAR BUSTOS 480-1910 ------ 480-2851;2016;31 de diciembre;;X;;2011;
752;CENTRO DE FOMENTO AGUSTIN B. GAMBIER;01/01/1998;46 Nº 1864 E/ 132 Y 133;SAN CARLOS;Promoción y Fomento;4;1900;;;;mayo 24 de 1951;;L: 47242 / M: 8060;1033/97;;823;;;;;FERRO HUGO A. TEL: 479-5253;1998 ( hay comisión directiva y acta de asamblea );;X;;X;;
753;"HOGAR PARA CHICOS DE LA CALLE ""SILVIO MIRASSO""";01/01/2006;122 Nº 141 E/ 34 Y 35 / 121 N° 128;C. URBANO NORTE;Asistencia Infancia y Adolescencia;2;1900;483-8361 / 422-9790;;;octubre 24 de 1994;;L: 73802 / M: 14333;1708/97;;824;;SI;;;MARTINEZ GOMEZ CARLOS TEL: 15-5529536/ 422-9790;2006;31 de diciembre;X;;X;;
754;ASAMBLEA PERMANENTE POR LOS DERECHOS HUMANOS LA PLATA;01/01/2006;49 N° 632 PISO 6 OF. 79 Y 80;C. URBANO NORTE;Derechos Humanos;1;1900;TEL / FAX: 482-0595;asamblea@lpsat.com /;;junio 27 de 1979;;L: 58494 / M: 13799;2474/97;;826;;;;;ANGELA VENDOLA;2006;;X;;X;;
755;ASOCIACION CUIDADORES UNIDOS CEMENTERIO DE LA PLATA;01/01/2001;31 Nº 2094;SAN LORENZO;Profesiones y Oficios;5;1900;422-4612;;;diciembre 17 de 1940;;L: 6444 / M. 2083;84/98;;828;;;;;FARIAS ANTONIO OSCAR TEL: 453-1062;2000-2001;;X;;X;;
756;FUNDACION FLORENCIO PEREZ;01/01/2003;DIAG.80 Nº 847;C. URBANO NORTE;Atención Adicciones;1;1900;TEL / FAX: 451- 3785 / 425-0101;;;junio 8 de 1990;;L: 58165 / M: 11384;86/98;;829;;;;;KRAISELBURD RAUL EDUARDO TEL: 471-3440;2002-2003;;X;;X;;
757;ATENEO POPULAR ALEJANDRO KORN U.P.A.K. Y BIBLIOTECA DR. FRANCISCO ROMERO DELGADO;01/01/2018;49 N° 731;C. URBANO NORTE;Promoción y Fomento;1;1900;483-6606;upak_49@hotmail.com;;;;L: 74087 / M: 14925;87/98;;830;;;;;PTE. RICARDO BERENGUER 15-4816548 484-7646 GABRIELA TROIANO TEL. NO SABEMOS DE QUIEN 15 5578787;2018;31 de julio;;;X;2010;
758;ASOCIACION VECINAL UNION MALVINENSE;01/01/2006;36 S/N E/ 149 Y 150;SAN CARLOS;Comedores;4;1900;;;;septiembre 7 de 1995;;L: 77677 / M: 14828;88/98;;831;;;;;VER LEGAJO;2006;31 de diciembre;;;X;;
759;CENTRO DE FOMENTO 25 DE MAYO;01/01/2010;56 N° 2396 E/ 142 Y 143;LOS HORNOS;Aprendizaje y Educación;3;1941;;;;junio 20 de 1975;;L: 58153 / M: 10794;89/98;;832;;;;;HECTOR PACHECO TEL: 450-1644;2009-2010;31 de marzo;X;;X;;
760;SIEMBRA;01/01/1995;151 E/ 70 Y 71;LOS HORNOS;Asistencia Familiar;3;1941;;;;mayo 17 de 1990;;L: 53968 / M: 9989;2362/97;;833;;;;;LADERACH MIRTA TEL: 450-5515;1995-1996;;;;X;;
761;ASOCIACION CIVIL DE VOLUNTARIOS NACIONALISTAS DE LA PROVINCIA DE BUENOS AIRES;01/01/2001;48 Nº 1516 E/ 25 Y 26;C. URBANO ESTE;Emergencias, Catástrofes y Prevención;4;1900;457-4666/457-7347;;;noviembre 23 de 1990;04/04/1991;L: 56253 / M: 10281;443/98;;834;;;;;ESCALANTE OFELIA T. TEL: 479-9798;2000-2001;;;;X;;
762;CENTRO VECINAL FRANCISCO VARGAS;01/01/2009;136 N° 100 ESQ. 531;SAN CARLOS;Asistencia Familiar;14;1900;470-5246;centrovecinalfranciscovargas@yahoo.com.ar;;;;L: 69648 / M: 13239;581/98;;836;;SI;;;GLADYS HAYDEE GONZALEZ TEL: 414-0778 / 154977792;2009;31 de diciembre;;;X;;
763;FUNDACION JUSTICIALISTA DE LA PLATA;01/01/1997;54 Nº 618 E/ 7 Y 8;C. URBANO SUR;Organizaciones Políticas;9;1900;422-9393;;;mayo 20 de 1992;;L: 62430 / M: 12098;743/98;;837;;;;;HNATIUK ROLANDO O.;1997;;;;X;;
764;CENTRO RECREATIVO VECINAL CAMPITO Nº 5 GAMBIER;01/01/2018;31 Nº 888 E/ 49 Y 50;C. URBANO ESTE;Deportes en general;4;1900;451-0373;cheloss@speedy.com.ar;;diciembre 18 de 1994;;L: 74584 / M: 14347;869/98;;842;;;;;BUSTOS GRACIELA TEL: 470-7748/ 15- 4889322;2018;31 de diciembre;;X;;2010;
765;FEDERACION COOPERADORAS ESCOLARES DISTRITO LA PLATA;01/01/2002;42 N° 358 E/ 2 Y 3;C. URBANO NORTE;Cooperación (Educación);2;1900;;;;noviembre de  1991;;L: 8888;953/98;;846;;;;;ILARREGUI MARCELO;2001-2002;;;;X;;
766;ASOCIACION DE FUTBOL INFANTIL DAGA;01/01/2000;27 Nº 768 E/ 47 Y 48;C. URBANO ESTE;Fútbol;4;1900;479-6271;;;enero 2 de 1997;;L: 88097 / M: 16927;1014/98;;847;;;;;STELLA M. ITARTE TEL: 479-6271;1999-2000;;;;X;;
767;COMISION VECINAL VILLA MONTORO;01/01/2006;122 N° 3488 E/ 601 Y 602;VILLA ELVIRA;Promoción y Fomento;8;1900;486-2158;;;Año 1988;;L: 46360 / M: 7823;947/98;;848;;;;;ISIDRO VERGARA MONTIEL;2006 Convocatoria de Asamblea para el 30/05);31 de diciembre;;;X;;
768;ESOS LOCOS BAJITOS;01/01/2012;508 E/ 10 Y 11;GONNET;Asistencia Infancia y Adolescencia;13;1897;484-0638;;;septiembre 30 de 1988;;L: 48355 / M: 8334;954/98;;849;;SI;;;ENRIQUE;2011-2012;30 de junio;X;;X;;
769;FUNDACION LOGROS;01/01/1995;14 N° 707;C. URBANO ESTE;Capacidades Diferentes (en general);2;1900;482-6997;;;junio 15 de 1994;;L: 73745 / M: 13911;951/98;;850;;;;;CAMPOAMOR SUSANA TEL: 424-3017;1995;;;;X;;
770;SILUVA;01/01/2010;23 N° 802 E/ 419 Y 420;VILLA ELISA;Capacidades diferentes (mental);12;1894;483-2130;centrodediasiluva@yahoo.com.ar;;diciembre 15 de 1994;;L: 74980 / M: 14258;952/98;;851;;SI;;;QUINTO ALEJANDRA TEL: 487-0635;2009-2010;30de diciembre;X;X;;2011;
771;FUNDACION PRO HUMANAE VITAE;01/01/2011;48 N° 632 P 6 OF. 75 / 8 BIS N° 215 E/ 83 Y 84;C. URBANO NORTE;Promoción y Fomento;1;1900;482-8815 / 422-8588;presidente@fphv.org;;octubre 31 de 1995;19/03/1996;L: 80029 / M: 15339;949/98;;852;;;;;SANCHEZ GRACIELA 15 4209730;2011;31 de diciembre;;;X;;
772;JUNTA VECINAL 26 DE JULIO;01/01/2015;13 Y 88;VILLA ELVIRA;Promoción y Fomento;8;1900;457-6228;;;marzo 28 de 1994;;L: 71497 / M: 14071;958/98;;854;;;;;GONZALEZ JOSE LUIS 451-9857;2015;31 de diciembre;;;X;2010;
773;VINCULOS;01/01/2004;41 N° 921 1/2 Dto. 1°;C. URBANO ESTE;Asistencia Familiar;2;1900;421-3030 / 425-7258;edagost@netverk.com.ar;;marzo 5 de 1992;;;;;856;;;;;actualizar;2003-2004 ( Presentarán rectificación del Acta de Asamblea Anual Ordinaria por mala redacción y Acta donde consta la renuncia del Dr. D' Agostino );;;;X;;
774;ASOCIACION DE PADRES DE PACIENTES CON ENFERMEDADES NUTRICIONALES (A.P.P.E.N.);01/01/1995;14 Nº 1631;C. URBANO SUR;;9;1900;;;;;;;Dto. de baja 389/02;;857;;;x;;;1995-1996;;;;;;
775;FUNDACION PARA LA PREVENCION DE ADICCIONES  (FU.P.P.AD);01/01/1996;DIAG. 80 Nº 155 E/ 39 Y 40 / 39 N° 84;C. URBANO NORTE;Atención Adicciones;2;1900;;;;octubre 14 de 1995;;L: 79548 / M: 15417;1018/98;;858;;;;;;1996;;;;X;;
776;ASOCIACION PADRES DE HIJOS ESPECIALES ( A.P.H.E. );01/01/2011;40 nº 587;C. URBANO SUR;Autoayuda;9;1900;451-2248;;;agosto 20 de 1994;;L: 72824 / M: 13760;1082/98;;860;;SI;;;VILLEGAS CESAR;2010-2011 falta bce;30 de setiembre;;;X;;
777;ASOCIACION DE PADRES DE NIÑOS CON MALFORMACIONES CRANEO-MAXILO FACIALES Y FISURADOS ( A.PA.M.Y F. );01/01/2011;14 Nº 1631 E/ 65 Y 66;C. URBANO SUR;Autoayuda;9;1900;;apamifpadresunidos@hotmail.com;;febrero 20 de 1996;;L: 80840 / M: 15505;950/98;;862;;;;;CLAUDIO RODAS TEL: 486-4010 secr. MARTA MONDAINI 486-4492 15 5087839;2011;31 de diciembre;;X;;;
778;CENTRO ASISTENCIAL MONSEÑOR ROBERTO LODIGIANI CARITAS PARROQUIA NUESTRA SEÑORA DEL PILAR;01/01/2018;33 Nº 984;C. URBANO ESTE;Asistencia Familiar;2;1900;;;;agosto 29 de 1992;;L: 75481 / M: 14343;966/98;;863;SI;;;;PTE SEILLANT JUAN 424-3904 VICE TOIGO RICARDO 425-1392 TESORERO GANGOITI RUBEN EDUARDO 425-1402;2018;31 de diciembre;X;X;;;
779;ASOCIACION CRISTIANA EL BUEN SAMARITANO;01/01/2017;99 Nº 567;VILLA ELVIRA;Aprendizaje y Educación;8;1900;486-2727;;;diciembre 25 de 1995;15/03/1996;L: 80389 / M: 15321;1165/98;;865;SI;;;;ARES ELIDA TEL: 15-4954187/ 486-2727 DOS SANTOS CINTIA E. 15 5042734;2017;31 de diciembre;X;X;;;
780;CENTRO DE DIA LA CASA DEL SOL;01/01/2015;47 Nº 1315 / 455 e/ 21 d y 22 Citty Bell;C. URBANO ESTE;Capacidades diferentes (motora);4;1900;479-6302;lacasadelsol47@hotmail.com;;18 de Abril 1995;;L: 76445 / M: 14556;1164/98;;866;;;;;CLAUDIA COLOMBO;2015;31 de diciembre;X;;X;2010;
781;COMEDOR COMUNITARIO GAUCHITO GIL;01/01/2003;168 E/ 518 Y 519;ROMERO;Comedores;14;;;;;octubre 30 de 2000;;L: 106948;672/04;;1112;;;;;MANUEL CURIMA TEL: 478-1117;2003;;;;X;;
782;FEDERACION DE BIBLIOTECAS POPULARES DE LA PROVINCIA DE BUENOS AIRES ZONA CAPITAL;01/01/2020;22 N° 986 ESQ. 53;C. URBANO SUR;Bibliotecas;9;1900;;;;noviembre 3 de 1994;;L: 76585 / M: 16056;1359/04;;1113;;;;;MIGUEL OBERTI;2020;30 de junio;;x;;;
783;HOGAR S.E.R.A;01/01/2006;423 BIS E/ 14 Y 14 BIS;VILLA ELISA;Asistencia Infancia y Adolescencia;12;1894;;;;junio 13 de 2002;;L: 1/115350 / M: 24804;735/04;;1114;;;;;DELIA DE ELIA;2005-2006;30 de septiembre;;;X;;
784;CENTRO RECREATIVO Y CULTURAL ENTRE NOSOTROS CRECEN;01/01/2004;71 N° 1777;C. URBANO SUR;Comedores;5;1900;;;;mayo 18 de 2002;;L: 1/115042 / M: 24249;734/04;;1115;;;;;GRBIN HEBE NINA TEL: 15 - 5080398;2004;;;;X;;
785;CENTRO RECREATIVO Y DEPORTIVO 7 DE ENERO;01/01/2003;638 Y 125;VILLA ELVIRA;Fútbol;8;1900;;;;marzo 5 de 2003;;En trámite;772/04;;1116;;;;;ALEMAN HUGO TEL: 486-0115;2003 ( declaración jurada de patrimonio );;;;X;;
786;EGRESAR ( CENTRO DE EX ALUMNOS DE LA ESCUELA NACIONAL SUPERIOR DE COMERCIO GRAL. SAN MARTIN );01/01/2003;46 N° 366;C. URBANO NORTE;Aprendizaje y Educación;1;1900;;;;noviembre 3 de 2003;;L: 125418 / M: 27199;859/04;;1117;;;;;FLUXA ELISEO JORGE TEL: 154591876;2003;;;;X;;
787;DEL ROSARIO DE MELCHOR ROMERO;01/01/2004;525 E/ 158 Y 159;ROMERO;Copas de Leche;7;;;;;mayo 31 de 2004;;L: 128541 / M: 28481;866/04;;1118;;;;;GUDIÑO OMAR LUIS TEL: 478 - 0062 (Vecino);2004 ( declaración jurada de patrimonio );;;;X;;
788;ASOCIACION DE LUCHA CONTRA EL MAL DE ALZHEIMER Y ALTERACIONES SEMEJANTES (A.L.M.A.);01/01/2003;508 Y CNO. GRAL. BELGRANO;GONNET;Asistencia y Prevención;13;1897;;;;enero 27 de 2004;;L: 1/128106 / M: 28546;867/04;;1119;;;;;NEGRI MARIA CRISTINA TEL: 424-5599;2003 ( declaración jurada de patrimonio );;;;X;;
789;CENTRO MAGICO PLATENSE;01/01/2016;49 Nº 835 E/ 11 Y 12 (FALTA APROBACIÓN DE JURÍDICAS);C. URBANO SUR;Promoción y Fomento;9;1900;451-2198 ( TEL / FAX );centromagicoplatense@yahoo.com / ren_nee@hotmail.com;;marzo 14 de 1958;;L: 39268 / M: 5517;1163/98;;867;;;;;RENE OSCAR HERNANDO TEL: 451-1516 / 453-4210 (15) 5691245;2016-2017;30 de abril;;X;;2011;
790;GRUPO DE LA TERCERA EDAD JOVENES DE ANTES;01/01/1997;79 E/ 131 Y 132 / 80 N° 1769 E/ 30 Y 31;SAN LORENZO;Actividades y terapias recreativas;3;1900;457-2647;;;septiembre 10 de 1996;;L: 88152 / M: 17056;1161/98;;868;;;;;CAVALLARO ALFREDO TEL: 453-6315;1997-1998;;;;X;;
791;FUNDACION ARGENTINA DE DEPORTE Y CULTURA (F.A.D.Y.C);01/01/1996;54 Nº 1088 P 1 E/ 16 Y 17;C. URBANO SUR;Promoción y Fomento;9;1900;453-3953;;;septiembre 30 de 1994;;L: 74977 / M: 15064;1160/98;;869;;;;;DARDO O. DE CRISTOFARO;1996;;;;X;;
792;UNION DE MUJERES PLATENSES (UMUPLA);01/01/2001;60 N° 2670 /  57 N° 553;LOS HORNOS;Aprendizaje y Educación;3;1941;482-3031;;;junio 23 de 1995;;L: 77380 / M: 14687;1162/98;;870;;;;;AGÜERO ELDA SUSANA TEL: 450-8023;2001;;;;X;;
793;EL DOGMA;01/01/1998;518 Y 166;ROMERO;Atención Adicciones;14;;478-0178;;;febrero 4 de 1997;;L: 85271 / M: 16419;1159/98;;871;;;;;MARIA CELIA CARRION;1998;;;;X;;
794;CENTRO DE ESTUDIANTES SANTACRUCEÑOS;01/01/2001;1 Nº 1478;C. URBANO SUR;Asistencia Estudiantil;9;1900;;;;Año 1985;;L: 38734 / M: 5473;1266/98;;872;;;;;NELSON VIGUERAS;2000-2001;;;;X;;
795;CORAZON DE AMOR;01/01/1998;52 Y 162;OLMOS;Asistencia Infancia y Adolescencia;7;;423-5230;;;octubre 1 de 1996;;L: 84811 / M: 16671;1268/98;;873;;;;;MARIA CELESTE PALAVECINO TEL: 470-4177;1998;;;;X;;
796;DARSE CUENTA;01/01/2012;CNO. GRAL. BELGRANO KM. 12500 E/ 446 Y 447;CITY BELL;Atención Adicciones;10;1896;487-1096;;;julio 15 de 1996;;L: 84116 / M: 16284;1269/98;;874;;SI;;;HORACIO SALOMON TEL: 011-15-51852584 - HUGO 487-1096;2012;31 de diciembre;;;X;;
797;INSTITUTO HERMANAS DE LA INMACULADA;01/01/1994;149 E/ 64 Y 65;LOS HORNOS;Asistencia y Caridad;3;1941;450-5356 / 450-9304;;;mayo 29 de 1913;;;1270/98;;875;;;;;MARIA MAGDALENA BUSTAMANTE;1994-1995;;X;;X;;
798;IGLESIA EVANGELICA PENTECOSTAL ARGENTINA;01/01/1997;156 E/ 526 Y 527;ROMERO;Culto;14;;478-1771 / 470-3278;;;septiembre 5 de 1954;;;1321/98;;876;;;;;PASTOR BARRIOS RICARDO;1997;;X;;X;;
799;ASOCIACION  DE PADRES Y AMIGOS DEL SORDO BONAERENSE ( A.P.A.S.);01/01/2014;45 nro. 1008;C. URBANO ESTE;Capacidades diferentes (hipoacúsicos);1;1900;423-5234;apasbonaerense@yahoo.com.ar;;septiembre 29 de 1995;;L: 78962 / M: 15337;1363/98;;877;;;;;LILIANA EFESI 15 4197210 TESORERA GRACIELA CITARELLA 15 5902734;2014 (cd hasta dic 2016);10 de diciembre;;X;;;
800;UNION DE FAMILIAS DE ARTURO SEGUI;01/01/2001;9 DE JULIO Y URQUIZA;ARTURO SEGUI;Asistencia Familiar;12;1895;;;;julio 20 de 1993;;L: 67018 / M: 12720;1267/98;;878;;;;;VIRGINIA BRITOS TEL: 474-0349;2000-2001;;;;X;;
801;CENTRO CULTURAL COMUNITARIO ZONA OESTE;01/01/2011;155 BIS E/32 Y 33 S/N;ROMERO;Centros Culturales;14;;470-5529;ccczonaoeste@gmail.com;;septiembre 14 de 1996;;L: 83903 / M: 16098;1322/98;;879;;;;;JULIA MALVINA CISNEROS;2011 falta acta de asamblea;31 de diciembre;;;X;;
802;ROTARY CLUB DE CITY BELL;01/01/2008;PAUL HARRIS N° 150 E/ PELLEGRINI Y 15;CITY BELL;Servicios;10;1896;;gantonioli@intramed.net.ar / rgenoro@infovia.com.ar;;marzo 20 de 1964;;L: 87380 / M: 16666;2026/98;;880;;;;;VILLANUEVA OSVALDO;2007-2008;30 de junio;X;;X;;
803;AGRUPACION DEPORTIVA INFANTIL PLATENSE A.D.I.P.;01/01/2018;8 Y 526 (11 e/ 524 y 525 Nº 732 Correspondencia);TOLOSA;Fútbol;6;1906;;adipfutbol@hotmail.com / racasanovas@hotmail.com;;agosto 7 de 1986;;L: 44028 / M: 7050;1673/98;;881;;;;;RUBEN ANTONIO TEL: 15-5449187;2018;20 de diciembre;X;X;;2011;
804;FUNDACION RUMBOS DE INTEGRACION Y DESARROLLO REGIONAL;01/01/2002;57 E/ 21 Y 22;VILLA ELISA;Promoción y Fomento;12;1894;498-5662;fundacionrumbos@lasdiagonales.com;;agosto 5 de 1992;;;1746/98;;882;;;;;PINEDA HORACIO  SECRETARIA: ESPAÑOL GRACIELA TEL: 473-2177;2002;;;;X;;
805;SOCIEDAD DE FOMENTO POLIDEPORTIVO GONNET;01/01/2012;484 Y 19 (LEG. MITRE 2345 E/ 18 Y 19 );GONNET;Fútbol;10;1897;471-5401;;;octubre 10 de 1982;;L: 30186 / M: 7009;1672/98;;883;;;;;MARCELO RAUL COUTINHO;2011-2012 faltas bce 2010 y acta 2011;31 de marzo;X;;X;;
806;CONGREGACION SAN TIMOTEO DE LA IGLESIA EVANGELICA LUTERANA UNIDA;01/01/1993;10 Nº 1373 E/ 60 Y 61;C. URBANO SUR;Culto;9;1900;452-5206;;;21 de Abril 1957;;;1807/98;;884;;;;;PASTOR AUGUSTO FERNANDEZ;1993;;X;;X;;
807;JUNTA VECINAL NUEVA ESPERANZA;01/01/1999;520 Y 160;ROMERO;Promoción y Fomento;14;;478-0109;;;junio 17 de 1995;;L: 77198 / M: 14786;1806/98;;885;;;;;CESAR OMAR LAREZ;1999;;;;X;;
808;ASOCIACION DE AMIGOS DEL HOSPITAL  DR. RODOLFO ROSSI;01/01/2001;37 Nº 183;C. URBANO NORTE;Cooperación (Salud);2;1900;427-2430;;;octubre 2 de 1996;;L: 84272 / M: 16220;1805/98;;886;;;;;ALDO R. PODESTA;2000-2001;;;;X;;
809;LOS CHICOS;01/01/1997;10 Nº 2094;VILLA ELVIRA;;8;1900;;;;;;;Disp. N° 5/01;;888;;;x;;;1997-1998;;;;X;;
810;A.M.A.R. LA PLATA (AYUDA MUTUA PARA PACIENTES CON ARTRITIS REUMATOIDEA);01/01/2017;50 Nº 374;C. URBANO NORTE;Autoayuda;1;1900;424-4370 / 451-4806;amarlaplata@hotmail.com;;;;L: 84706 / M: 16494;65/99;;889;;;;;LILIANA CONDORELLI 482-5508;2017;31 de diciembre;;X;;;
811;ENSEÑAR Y APRENDER;01/01/1994;70 E/ 154 Y 155;LOS HORNOS;Deportes en general;3;1941;450-1860;;;febrero 22 de 1994;;L: 70660 / M: 13.437;66/99;;890;;;;;FRANCISCO RODOLFO OSCAR TEL: 450-1804;1994-1995 ( durante los ejercicios 1996/1997/1998 la entidad no funcionó según acta de asamblea );;;;X;;
812;ASOCIACION DE CUIDADORES DE ANCIANOS DE LA PROVINCIA DE BUENOS AIRES;01/01/2004;10 Nº 81;C. URBANO NORTE;Aprendizaje y Educación;2;1900;482-1251/ 471-0876;;;febrero 3 de 1995;;L: 75742 / M: 15005;185/99;;891;;;;;NELIDA LIENDRO TEL: 470- 0876;2004;;;;X;;
813;SIN FRONTERAS;01/01/1998;65 Nº 422 1/2 E/ 3 Y 4 DPTO. C;C. URBANO SUR;Medio Ambiente;9;1900;422-1148;;;junio 23 de 1998;;L: 92654 / M: 17963;187/99;;892;;;;;BARCHINE ALEJANDRO;1998;;;;X;;
814;NUESTRO REFUGIO;01/01/1999;137 Nº 655;SAN CARLOS;Desarrollo Humano y Solidaridad Social (en general);4;1900;452-1389;;;enero 18 de 1997;;L: 85569 / M: 16340;188/99;;893;;;;;ABRAHAM JOSE  TEL: 470-1446;1999;;;;X;;
815;GRUPO DE TERCERA EDAD CLARO DE LUNA;01/01/2016;196 E/ 42 Y 43;OLMOS;Actividades y terapias recreativas;7;;;clarodelunaterceraedad@hotmail.com;;12 de Abril  1989;;L: 62497 / M: 11597;186/99;;894;;;;;LUYGO MODESTO RAMON;2015-2016;31 de enero;X;X;;;
816;CENTRO DE JUBILADOS Y PENSIONADOS 20 DE JUNIO;01/01/1997;121 BIS Nº 424 E/ 527 Y 528;TOLOSA;Actividades y terapias recreativas;6;1906;482-0460;;;;;L: 85611 / M: 16383;1804/98;;895;;;;;MOYANO RAMON TEL: 422-3496;1997;;X;;X;;
817;CLUB SOCIAL LA PLATA;01/01/1996;PLAZA  MAXIMO PAZ Nº 12;C. URBANO SUR;Deportes en general;9;1900;424-3331;;;septiembre 29 de 1989;;L: 51975 / M: 9326;2025/98;;896;SI;;;;CAROZZI RICARDO TEL: 453-9090;1996-1997;;X;;X;;
818;ASOCIACION AMIGOS VIDA (AS.A.VI);01/01/1997;19 Nº 1756 E/ 514 Y 515;RINGUELET;Capacidades diferentes (mental);11;1901;484-0680;;;julio 29 de 1997;;;1811/99;;900;;;;;ANDRIEU MARIA MARCELA;1997-1998;;;;X;;
819;ASOCIACION PERIODISTAS DEPORTIVOS DE LA PLATA BERISSO Y ENSENADA;01/01/2005;1 Nº 1220;C. URBANO SUR;Profesiones y Oficios;9;1900;489-3099;;;junio 11 de 1996;;L: 82543 / M: 15776;377/99;;901;;;;;MARCIAL CABELLO TEL: 155364539;2004-2005;;;;X;;
820;FUNDACION A.N.D.A.( AYUDA AL NIÑO CON DIFICULTADES DE APRENDIZAJE );01/01/1997;41 Nº 515;C. URBANO NORTE;Capacidades Diferentes (en general);2;1900;425-1897;;;septiembre 2 de 1995;;L: 78830 / M: 15130;588/99;;903;;;;;ENRIQUE IDIART TEL: 451-2940;1997-1998;;;;X;;
821;FUNDACION MEDICINA POR IMAGENES DE LA CIUDAD DE LA PLATA;01/01/1998;40 Nº 506;C. URBANO NORTE;Especialidades Médicas;2;1900;423-1111/12/13;;;noviembre 16 de 1990;;L: 55732 / M: 10140;378/99;;904;;;;;POGGIO GUSTAVO;1998-1999;;;;X;;
822;FUNDACION CASA RICARDO BALBIN;01/01/1997;49 Nº 844;C. URBANO NORTE;Organizaciones Políticas;1;1900;421-5353;;;diciembre 28 de 1996;;L: 83571 / M: 16453;834/99;;905;;;;;FERRER RICARDO OMAR;1997;;;;X;;
823;FUNDACION GARBUGLIA;01/01/2012;509 Nº 1762  E/ 12 Y 13;RINGUELET;Capacidades Diferentes (en general);6;1901;484-2023;marcos@fg.org.ar;;noviembre 14 de 1997;;L: 89964 / M: 17979;712/99;;906;;;;;GARBUGLIA MARCOS TEL: 15- 5646020;2012;31 de diciembre;;X;;2011;
824;CENTRO CULTURAL VIEJO ALMACEN EL OBRERO;01/01/2018;13 Nº 1900 ESQ. 71;C. URBANO SUR;Centros Culturales;9;1900;451-9497;vaelobrero@hotmail.com;;12 de Abril 1996;;L: 80503 / M: 15336;714/99;;907;;;;;SOSA ADRIANA MYRTHA;2018;30 de junio;;X;;2010;
825;CENTRO DE FOMENTO CULTURAL Y DEPORTIVO LA NUEVA UNION;01/01/2002;119 E/ 517 Y 518 ( SEDE 519 E/ 19 Y 20);RINGUELET;Promoción y Fomento;11;1901;471-3097 ( vicepresid. );;;febrero 15 de 1997;;L: 85466 / M: 16346;906/99;;908;;;;;VILA RAUL OMAR;2002;;;;X;;
826;CENTRO DE EQUITACION PARA PERSONAS CON DISCAPACIDAD Y CARENCIADAS;01/01/2002;41 E/ 120 Y 121;C. URBANO NORTE;Capacidades Diferentes (en general);2;1900;423-1070 / 71 INT 207;;;febrero 15 de 1997;;L: 85689 / M: 16408;838/99;;909;;;;;ALEJANDRA MERCEDES CERCATO;2001-2002 ( resta presentar datos de la comisión directiva );;;;X;;
827;ASOCIACION ECOLOGICA FORO VERDE;01/01/1996;DIAG. 79 Nº 371 E/ 116 Y 117 ( LEGAL ) / 19 ESQ.13 CITY BELL;C. URBANO SUR;Medio Ambiente;9;1900;483-4270 / 482-6448;;;junio 5 de 1991;;L: 57362 / M: 19635;951/99;;910;;;;;OLIVIER SANTIAGO;1996-1997;;;;X;;
828;BIBLIOTECA POPULAR JUAN DOMINGO PERON;01/01/2007;41 Nº 117 E/ DG. 80 Y 118;C. URBANO NORTE;Bibliotecas;2;1900;;;;12 de Abril  1985;;L: 38965 / M: 5448;837/99;;911;;;;;EDGARDO NORBERTO CHACON TEL: 453-2254;2007;31 de diciembre;;;X;;
829;PROGRAMA LABORAL DE ALBERGUE AL DISCAPACITADO (PRO.LA.DI.);01/01/2007;28 Nº 3656 E/ 496Y 496 BIS;GONNET;Capacidades diferentes (mental);13;1897;423-4053;;;julio 28 de 1991;;L: 57641 / M: 1684;1006/99;;912;;;;;ZARATE CLAUDIA;2006-2007;31 de julio;;;X;;
830;SOCIEDAD ARGENTINA DE SINDROME DE DOWN MENTES FECUNDAS;01/01/1997;49 Nº 958;C. URBANO ESTE;Capacidades diferentes (mental);1;1900;;;;octubre 13 de 1997;;L: 88874 / M: 1793;1003/99;;913;;;;;PENDON JOSE LUIS TEL: 461-5345;1997-1998;;;;X;;
831;ASOCIACION DE AMIGOS DEL TEATRO INDEPENDIENTE ARENAS;01/01/1999;45 N° 1666 E/ 28 Y 29;C. URBANO ESTE;Promoción y Fomento;4;1900;154-593948;tiaarenas@starmedia.com;;marzo 7 de 1999;;L: 96420 / M: 19273;1690/99;;915;;;;;HOLGADO LUIS  TEL: 479-2291;1999;;;;X;;
832;FUNDACION MARIA REINA;01/01/1997;45 Nº 510 PISO 2º DTO. E;C. URBANO NORTE;Culto;1;1900;;;;mayo 22 de 1989;;L: 51572 / M: 10493;1809/99;;917;;;;;MARTINEZ ELENA ( APODERADA) TEL: 471-5570;1997-1998;;;;X;;
833;CENTRO DE FOMENTO Y DEPORTIVO LA ESPERANZA;01/01/2015;522 Nº 264 E/ 117 Y 118;TOLOSA;Deportes en general;6;1906;425-4569;;;mayo 25 de 1996;;L: 85084 / M: 16787;1812/99;;918;;SI;;;PEREZ CAROLINA 3185686;2014-2015;30 de junio;;;X;;
834;CENTRO DE FOMENTO VILLA GARIBALDI;01/01/2001;659 Y 16 (LA QUINTA DE ALDO);VILLA ELVIRA;Promoción y Fomento;8;1900;491-0376;villagaribaldi@topmail.com.ar;;junio 1 de 1995;;L: 76936 / M: 14940;1806/99;029480/99;919;;;;;NASCIMBENE MARCELO;2001;31 de diciembre;;;X;;
835;ASOCIACION DE KARATE KEMPO Y DEFENSA PERSONAL;01/01/1998;21 E/ 51 Y 53 (CLUB PLATENSE);C. URBANO SUR;Disciplinas Orientales;5;1900;479-7049;;;mayo 17 de 1997;;L: 92822 / M: 18215;1807/99;;920;;;;;ZEKI JORGE TEL: 154-855951;1998;;;;X;;
836;ASOCIACION DE FOMENTO Y BIBLIOTECA POPULAR LAVALLE BILLAR CLUB;01/01/2018;34 Nº 737;C. URBANO NORTE;Promoción y Fomento;2;1900;424-9385;danielyunan@hotmail.com;;junio 19 de 1997;;L: 88073 / M: 19626;1810/99;;921;SI;;;;MENDY MARCELO;2018;31 de diciembre;X;X;;2019;
837;ASOCIACION DE MUJERES UNIVERSITARIAS DE LA PLATA ( AMULP );01/01/1998;117 N° 1890 / 1 N° 1614;C. URBANO SUR;Profesiones y Oficios;9;1900;422-3869 / 452-4844 / 425-8842;;;diciembre de 1989;;L: 57350 / M: 11023;1987/99;;922;;;;;ARMENGOL MARIA FERNANDA TEL: 425-4499;1998-1999;;;;X;;
838;HIJAS DE NUESTRA SEÑORA DE LA MISERICORDIA;01/01/2005;4 Nº 588;C. URBANO NORTE;Aprendizaje y Educación;2;1900;421-0476;;;;;;1813/99;;924;;;;;HNA.SUSANA.M.E.RABURO;2005;;;;X;;
839;CENTRO DE FOMENTO CULTURAL Y DEPORTIVO ALBORES JUVENILES;01/01/2008;515 ESQ 21;HERNANDEZ;Promoción y Fomento;11;;;;;diciembre 14 de 1948;;L: 50909 / M: 9271;26/00;;925;;;;;PIROLA OSCAR LUIS TEL: 489-7754 (Paula);2008;31 de diciembre;X;;X;;
840;VER-DI;01/01/1998;65 Nº 725 E/ 9 Y 10 ADMINISTRACION / 17 N° 367;C. URBANO SUR;Atención Adicciones;9;1900;453-1134 / 450-0846;;;;;L: 77247 / M: 14904;101/00;;926;;;;;GONZALEZ PABLO TEL: 450-0846;1998;;;;X;;
841;HOGAR DON BOSCO PARA CHICOS DE LA CALLE;01/01/2014;44 Nº 1150 ESQ. 18 / 47 N° 1372 E/ 136 Y 137;C. URBANO ESTE;Asistencia Infancia y Adolescencia;1;1900;479-2287 / 483-5336;hogardonbosco_laplata@yahoo.com.ar;;noviembre 17 de 1988;;L: 49352 / M: 8543;908/00;;927;;SI;;;SERGIO G. GARCIA  15 4883569;2013-2014;30 de abril;X;;X;;
842;ASOCIACION PLATENSE DE AYUDA A LAS PERSONAS CON CAPACIDADES DIFERENTES ( A.P.CA.DI.);01/01/2018;58 Nº1190;C. URBANO SUR;Capacidades diferentes (iniciación productiva);9;1900;451-5059;tallerjacaranda58@gmail.com;;17 de Abril 1998;;L: 91732 / M: 17708;909/00;;928;;;;;Arabel Silvana(pte);2018;31 de diciembre;;X;;2019;
843;CIRCULO DOCENTE DE EDUCACION FISICA ( C.I.D.E.F. );01/01/2005;6 Nº 1030 (SEDE PROVISORIA);C. URBANO SUR;Profesiones y Oficios;1;1900;421-9286;circulodocenteseducacionfisica@yahoo.com.ar / cidef_ar@yahoo.com.ar;;junio 12 de 1997;;L: 87914 / M: 17130;982/00;;929;;;;;MIGUEL IGNOMIRIELO 422-5532;2005;;;;X;;
844;HOGAR PARA NIÑOS DE LA CALLE ALBERGUE TRANSITORIO GRANJA PEQUEÑO HOGAR CONVIVENCIAL  RAYUELA;01/01/2017;119 Nº 282 E/ 37 Y 38 ( LEGAL );C. URBANO NORTE;Asistencia Infancia y Adolescencia;2;1900;483-1826;hogar_rayuela@hotmail.com;;octubre 10 de 1998;;L: 94619 / M: 19057;861/00;;930;SI;SI;;;JUAN CARLOS SANTAREN 15 5998677;2017;31 de diciembre;X;X;;;
845;ASOCIACION REGIONAL DE SOFTBOL;01/01/1998;29 Nº 1482;C. URBANO SUR;Softbol;5;1900;427-2350/51;;;octubre 11 de 1968;;L: 95306 / M: 18734;981/00;;931;;;;;SCIAMMARO DONATO TEL: 452-3645;1998-1999;;;;X;;
