1048;LA MAQUINA DE LOS SUEÑOS;01/01/2018;148 E/ 35 Y 36;SAN CARLOS;Asistencia Infancia y Adolescencia;4;1900;479-0265;lamaquinadelossuenos@yahoo.com.ar;;febrero 28 de 1999;;L: 95143 / M: 19211;212/05;;1171;SI;;;;PTA CAVALIERI GRACIELA - TESORERA NELIDA TARQUINO 425-0365;2018;30 de septiembre;;X;;;
1049;COMEDOR Y COPA DE LECHE REY DE REYES;01/01/2003;523 E/ 15 Y 16;TOLOSA;Comedores;11;1906;489-3791;;;;;L: 66460 / M: 12589;211/05;;1172;;;;;PIEDRABUENA MARIA ELENA TEL: 484-0114 / 489-4829;2002-2003;;;;X;;
1050;ASOCIACION LEONISMO DEL DISTRITO 05-ARGENTINA-MEGAPROYECTO DEJEMOS ENTRAR EL SOL;01/01/2005;18 N° 398 P 4 DTO. A;C. URBANO ESTE;Desarrollo Humano y Solidaridad Social (en general);2;1900;423-7724;;;agosto 15 de 2004;;L: 130394;236/05;;1173;;;;;JUAN CARLOS POZZI;2005 ( declaración jurada de patrimonio );;;;X;;
1051;AUXILIADORA;01/01/2006;37 E/ 178 Y 179;OLMOS;Equipamiento e Infraestructura;14;;;;;noviembre 2 de 2003;;L: 126947 / M: 28066;218/05;;1174;;;;;VENANCIO RITA;2006;31 de diciembre;;;X;;
1052;CENTRO CULTURAL BETO GIANOLA DE VILLA ELVIRA;01/01/2004;652 ESQ. 8;VILLA ELVIRA;Promoción y Fomento;8;1900;;;;octubre 25 de 2004;;En trámite;254/05;;1175;;;;;NESTOR OMAR SANTO TEL: 491-0095;2004 ( declaración jurada de patrimonio );;;;X;;
1053;COMEDOR INFANTIL SONRISA DE UN NIÑO;01/01/2003;34 ESQ. 151;SAN CARLOS;Comedores;4;1900;479-8444;;;diciembre 19 de 2000;;L: 108083 / M: 22522;748 / 05;;1177;;;;;SOTELO LIDIA ANGELICA TEL: 479-8444;2003;;;;X;;
1054;ASOCIACION CIVIL DE FOMENTO SOCIAL CULTURAL Y DEPORTIVO RINCON DE LUZ;01/01/2004;144 E/ 526 Y 527 S/N;SAN CARLOS;Desarrollo Humano y Solidaridad Social (en general);14;1900;;;;junio 3 de 2003;;L: 121448 / M: 26624;;;1178;;;;;MONZON RAMONA TEL: 470-6948;2003-2004;;;;X;;
1055;UNION VECINAL CON GANAS DE VIVIR;01/01/2004;145 N° 180 E/ 35 Y 36;SAN CARLOS;Desarrollo Humano y Solidaridad Social (en general);4;1900;479-3788;;;julio 10 de 2003;;L: 122746 / M: 27315;321/05;;1179;;;;;MEDINA GONZALEZ MARIA DEL CARMEN;2004 ( declaración jurada de patrimonio );;;;X;;
1056;HOGAR SAN FRANCISCO;01/01/2005;167 E/ 73 Y 75;LOS HORNOS;Asistencia Infancia y Adolescencia;3;1941;;;;septiembre 27 de 1992;;;320/05;;1180;;;;;CLAUDIO E. MIRASSO TEL: 456-2259;2005;;;;X;;
1057;ASOCIACION VECINOS DE LAS 10 MANZANAS;01/01/2003;17 N° 2243;GONNET;Equipamiento e Infraestructura;13;1897;484-2855;;;septiembre 6 de 2003;;no posee;389/05;;1181;;;;;PACE JULIO CESAR;2003 ( declaración jurada de patrimonio );;;;X;;
1058;CLUB RECREATIVO INFANTO JUVENIL COMODORO RIVADAVIA;01/01/2005;120 N° 67;C. URBANO NORTE;Fútbol;2;1900;425-1271;;;febrero 21 de 2004;;L: 1/126916 / M: 27737;376/05;;1182;;;;;SILVESTRI SERGIO TEL: 421-4727;2005;;;;X;;
1059;COMEDOR COMIENDO EN FAMILIA;01/01/2004;429 E/ 27 BIS Y 28;VILLA ELISA;Comedores;12;1894;;;;febrero 17 de 2004;;en tramite;538/05;;1183;;;;;RAMIREZ ANGEL TEL: 154813766;2004 ( declaración jurada de patrimonio );;;;X;;
1060;EL OTRO ESPEJO AUTISMO;01/01/2004;532 N° 883;TOLOSA;Autoayuda;6;1906;;;;noviembre 12 de 2003;;L: 125509 / M: 27535;539/05;;1184;;;;;DANIELA A. LARRACHAO TEL: 424-6850;2004 ( declaración jurada de patrimonio );;;;X;;
1061;EL BOHIO;01/01/2004;131 N° 746 DTO. E / 153 Y 516 Sede Social;C. URBANO ESTE;Atención Adicciones;4;1900;;;;diciembre 12 de 2000;;L: 109241 / M: 22863;487/05;;1185;;;;;DEBORA RAQUEL ANSELMINO TEL: 471-2385;2004 ( faltan firmas );;;;X;;
1062;HOGAR ARROZ CON LECHE;01/01/2005;519 E/ 212 Y 213;ABASTO;Asistencia Infancia y Adolescencia;7;1903;;;;septiembre 21 de 1999;;L: 99792 / M: 20166;488/05;;1186;;SI;;;IRENE NUÑEZ TEL: 491-3961;2005;;;;X;;
1063;FORJARSE;01/01/2004;59 N° 916;C. URBANO SUR;Desarrollo Humano y Solidaridad Social (en general);9;1900;;;;mayo 17 de 2004;;L: 129032 / M: 28093;489/05;;1187;;;;;MARIA FLORENCIA JUAREZ TEL: 155608427;2004 ( declaración jurada de patrimonio );;;;X;;
1064;POR LOS DERECHOS SOCIALES DE LOS NIÑOS;01/01/2003;522 N° 213;TOLOSA;Asistencia Infancia y Adolescencia;6;1906;;;;agosto 20 de 2002;;L: 114545 / M: 24564;504/05;;1188;;;;;CARLOR RAFAEL TEL: 422-5544;2003;;;;X;;
1065;CORAZONES FELICES;01/01/2004;120 E/ 518 Y 519;RINGUELET;Desarrollo Humano y Solidaridad Social (en general);6;1901;471-7156;;;mayo 21 de 2001;;L: 110088 / M: 24367;608/05;;1189;;;;;VALDEZ OLGA TEL: 471-7156;2003-2004;;;;X;;
1066;CENTRO RECREATIVO Y CULTURAL  BARRIO SANTA ANA;01/01/2005;461 BIS E/ 14 Y 15;CITY BELL;Desarrollo Humano y Solidaridad Social (en general);10;1896;;;;noviembre 3 de 1999;;L: 1/100223 / M: 20334;1120/05;;1190;;;;;ORTIZ ROXANA EDITH TEL: 472-1884;2005 ( balance irregular del 15/1/05 al 15/2/05 );;;;X;;
1067;ASOCIACION CIVIL DE DESOCUPADOS SIN FINES DE LUCRO;01/01/2005;15 ESQ. 79 N° 2300;SAN LORENZO;Aprendizaje y Educación;8;1900;453-1596;;;marzo 4 de 2002;;L: 113842 / M: 24781;807/05;;1191;;;;;CABRAL RICARDO ALBERTO;2005;;;;X;;
1068;SOCIEDAD DE FOMENTO SOCIAL CULTURAL Y DEPORTIVO LA JOSEFA;01/01/2004;514 N° 2855;HERNANDEZ;Equipamiento e Infraestructura;11;;;;;noviembre 4 de 1989;;L: 52431 / M: 9429;809/05;;1192;;;;;GONZALEZ VALENTINA TEL: 484-4374;2003-2004;;;;X;;
1069;CENTRO CULTURAL SOCIAL Y DEPORTIVO UNION Y AMISTAD;01/01/2004;151 E/ 63 Y 64 S/N;LOS HORNOS;Copas de Leche;3;1941;;;;mayo 10 de 2004;;L: 126905 / M: 27738;813/05;;1193;;;;;GOMEZ EDUARDO R. TEL: 154-281618;2004 ( declaración jurada de patrimonio );;;;X;;
1070;COMEDOR Y COPA DE LECHE TODO POR NUESTROS NIÑOS;01/01/2004;151 E/ 57 Y 58;LOS HORNOS;Desarrollo Humano y Solidaridad Social (en general);3;1941;;;;mayo 25 de 2004;;en trámite;837/05;;1194;;;;;MENDEZ MARIA ESTER TEL: 154409989;2004 ( declaración jurada de patrimonio );;;;X;;
1071;FUNDACION DE ESTUDIOS REGIONALES;01/01/2003;7 N° 943 OFIC. 42;C. URBANO SUR;Centros de Estudios;9;1900;421-8566;fundafer@lpsat.com.ar;;;;L: 64086 / M: 14565;838/05;;1195;;;;;MARIA DEL CARMEN LUGONES TEL: 457-1725;2003;;;;X;;
1072;A.D.D.E.S. ( AUTOCONVOCADOS EN DEFENSA DE LOS DERECHOS DE LOS ENFERMOS DE SIDA );01/01/2005;523 E/ 20 Y 21;RINGUELET;Asistencia y Prevención;11;1906;;;;;;En Trámite;836/05;;1196;;;;;FLEITA JORGE HUGO TEL: 422-7473;2005 ( declaración jurada de patrimonio );;;;X;;
1073;PROFESORES DE EDUCACION FISICA SIN FRONTERAS DE LA PROVINCIA DE BUENOS AIRES;01/01/2005;37 N° 1657 E/ 28 Y 29;C. URBANO ESTE;Aprendizaje y Educación;4;1900;;;;octubre 8 de 2004;;L: 133454;929/05;;1197;;;;;JUAN CARLOS FEBRE;2005 ( declaración jurada de patrimonio ) Julio/06 modif. art. 1 Estatuto;;;;X;;
1074;ATENCION INTEGRAL A LA COMUNIDAD ( ASISTIR );01/01/2005;68 Nº 1202;C. URBANO SUR;Desarrollo Humano y Solidaridad Social (en general);9;1900;;;;mayo 4 de 2005;;En trámite;1041/05;;1198;;;;;COTLIAR ESTER SONIA ELENA TEL: 453-5485;2005 ( declaración jurada de patrimonio );;;;X;;
1075;CENTRO DE DESARROLLO COMUNITARIO VIRGEN DE LUJAN;01/01/2004;140 Y 525;SAN CARLOS;Comedores;14;1900;;;;16 de Abril  2005;;L: 1/114992 M: 24636;1040/05;;1199;;;;;ARMOA ANGELICA MAXIMA;2004;;;;X;;
1076;CENTRO DE FOMENTO SANTA ANA;01/01/2005;11 E/ 463 Y 464;CITY BELL;Desarrollo Humano y Solidaridad Social (en general);10;1896;;;;noviembre 8 de 1999;;L: 1/100236 / M: 20302;1039/05;;1200;;;;;CACERES CESAR B.;2005 ( balance irregular al 15 de enero );;;;X;;
1077;UNIDAD BARRIAL;01/01/2004;54 E/ 147 Y 148;LOS HORNOS;Desarrollo Humano y Solidaridad Social (en general);3;1941;;;;6 de Abril 2002;;L: 114655 / M: 24933;1071/05;;1201;;;;;OSCAR MAIDANA TEL: 479-9992 / 429-5651;2003-2004;;;;X;;
1078;CENTRO COMUNITARIO LOS GRILLITOS;01/01/2004;28 E/ 88 Y 89;SAN LORENZO;Copas de Leche;5;1900;;;;enero 12 de 2004;;;1073/05;;1202;;;;;ERCOLE MIRIAN TEL: 450-3001;2004 ( declaración jurada de patrimonio );;;;X;;
1079;CENTRO INTEGRAL DE LA MUJER ( C.I.M.);01/01/2004;DG. 73 Nº 1690 PISO 11 DEPTO. A;C. URBANO SUR;Promoción y Fomento;;1900;;sedecim@hotmail.com;;setiembre 11 de 1996;;L: 1/83949 / M: 16152;1072/05;;1203;;;;;ZELFA RUTH FERRARO TEL: 483-7878;2003-2004;;;;X;;
1080;DIGNIDAD;01/01/2004;28 Y 77;SAN LORENZO;Comedores;5;1900;;;;septiembre 17 de 2004;;;1070/05;;1204;;;;;SOSA ELSA NOEMI;2004 ( declaración jurada de patrimonio );;;;X;;
1081;EL PATO FELIZ;01/01/2005;17 Y 46;VILLA ELISA;Desarrollo Humano y Solidaridad Social (en general);12;1894;;;;febrero 12 de 2005;;En trámite;1160/05;;1205;;;;;OCAMPOS SUSANA ALICIA TEL: 487 - 0055;2005 ( declaración jurada de patrimonio );;;;X;;
1082;ORGANIZACION POR EL CRECIMIENTO Y EL BIENESTAR VECINAL;01/01/2005;C. GRAL. BELGRANO Y 415;VILLA ELISA;Desarrollo Humano y Solidaridad Social (en general);12;1894;;;;marzo 31 de 2005;;En trámite;1297/05;56219/05;1206;;;;;MARIESCURRENA GRACIELA TEL: 474-0013;2005 ( declaración jurada de patrimonio );;;;X;;
1083;COMISION VECINAL ESPERANZA DE VILLA MONTORO;01/01/2005;98 E/ 4 Y 5 S/Nº;VILLA ELVIRA;Desarrollo Humano y Solidaridad Social (en general);8;1900;;;;4 de Abril 2005;;L: 1/134884 M: 29386;1299/05;58670/05;1207;;;;;AVALOS DANIEL ANGEL TEL: 486-5319;2005  ( declaración jurada de patrimonio );6 de mayo;no;;X;;
1084;ABUELOS DE LA JOSEFA;01/01/2005;25 E/ 512 Y 512 BIS;HERNANDEZ;Actividades y terapias recreativas;11;;484-4278;;;marzo 1 de 2005;;;1298/05;59080/05;1208;;;;;VICECONTE OLGA BEATRIZ TEL: 484-6149;2005 ( declaración jurada de patrimonio );31 de agosto;;;X;;
1085;CENTRO DE TERCERA EDAD LA JOSEFA;01/01/2005;25 Nº 1992 E/ 512 Y 513;HERNANDEZ;Desarrollo Humano y Solidaridad Social (en general);11;;484-5853;;;febrero 23 de 2005;;L: 1/133903  M: 29347;1231/05;59964/05;1209;;;;;BORDA JORGE TEL: 484-5853;2005 ( declaración jurada de patrimonio ) Presentó convocatoria a Asamblea Anual para el 25/04;20 de diciembre;no;;X;;
1086;ASOCIACION DE AYUDA A FAMILIARES DE PERSONAS QUE PADECEN ESQUIZOFRENIA;01/01/2011;3 Nº 967;C. URBANO SUR;Autoayuda;1;1900;;aafeong@yahoo.com.ar;;marzo 19 de 2001;;L: 1/109965 M: 22994;1230/05;61213/05;1210;;;;;HERNANDEZ ISABEL B 484-3441/484-0203/452-7869/425-0395;2011;31 de diciembre;;;X;;
1087;CENTRO DE ESTUDIOS SOCIALES CONFLUENCIA;01/01/2005;2 Nº 344 E/ CANTILO Y 13;CITY BELL;Promoción y Fomento;10;1896;;;;junio 28 de 2005;;;1235/05;59081/05;1211;;;;;LOPEZ HERNAN G.TEL: (011)-1550299210;2005 ( declaración jurada de patrimonio );31 de diciembre;;;X;;
1088;"CENTRO DE ACTIVIDADES SOCIALES ""MELCHOR ROMERO""";01/01/2005;521 Nº 7370 E / 168 Y 168 BIS;ROMERO;Actividades y terapias recreativas;14;;;;;junio 19 de 2005;;En trámite;1296/05;58272/05;1212;;;;;BAZAN DOMINGO LAUREANO TEL: 478 - 6638;2005 ( declaración jurada de patrimonio );;;;X;;
1089;CORAZON DE MADRE;01/01/2005;77 E/ 134 BIS Y 135;SAN LORENZO;Asistencia Infancia y Adolescencia;3;1900;;;;diciembre 26 de 2004;;L: 1/132493  M: 29200;1356/05;;1213;;;;;SEMINO ANALIA TEL: 450-2431;2005 ( declaración jurada de patrimonio );;;;X;;
1090;MUSICA Y VOCES;01/01/2005;23 Nº 1462 E/ 62 Y 63;C. URBANO SUR;Promoción y Fomento;5;1900;451-4193;;;diciembre 16 de 2004;;En trámite L: 136287;1359/05;;1214;;;;;BELVEDERE HECTOR JOSE TEL: 451 - 4193;2005 ( declaración jurada de patrimonio );;;;X;;
1091;LUMEN ARTIS;01/01/2014;DIAG. URQUIZA Nº 347;CITY BELL;Promoción y Fomento;10;1896;;info@lumenartis.org.ar;;diciembre 2 de 2002;;L: 1/118712/M: 25692;1362/05;;1215;;;;;JORGE. E. GRAU (VERONICA: 15 6150917;2014;31 de diciembre;;X;;;
1092;C.I.E.M.S: CENTRO INTERDISCIPLINARIO DE ESTUDIO PARA EL MEJORAMIENTO DE LA SALUD;01/01/2005;DIAG. 79 Nº 957 PISO 16 DTO. A;C. URBANO SUR;Asistencia y Prevención;9;1900;;;;mayo 18 de 2005;;L: 1/136007/M: 29434;1361/05;;1216;;;;;RADOSINSKY ALICIA ROSA TEL: 421-4768;2005 ( declaración jurada de patrimonio );;;;X;;
1093;"GRUPOS RESONANCIAS ""ASOCIACION DE OPERADORES PSICOLOGIA SOCIAL"" CON TITULO OFICIALMENTE RECONOCIDO";01/01/2005;DIAG. 77 Nº 444;C. URBANO NORTE;Aprendizaje y Educación;1;1900;424-7240;;;14 de Abril  2004;;L: 128251/M: 28814;1546/05;63488/05;1218;;;;;LAGUENS JULIAN TEL: 424-7905;2005 ( declaración jurada de patrimonio );31 de marzo;no;;X;;
1094;UNION DE CARTONEROS PLATENSES;01/01/2005;78 Y 17;SAN LORENZO;Asistencia Familiar;8;1900;;;;junio 1 de 2005;;En trámite L: 1/136933;1545/05;60309/05;1219;;;;;FERNANDEZ GRACIELA TEL:15-4199729;2005 ( declaración jurada de patrimonio );;;;X;;
1095;PORVENIR PLATENSE;01/01/2020;42 E/ 133 Y 134;SAN CARLOS;Promoción y Fomento;4;1900;;;;;;L: 6551 / M: 42621;1534/05;50205/05;1220;;;;;GARNICA MATEO 15 4575875;2020 entrega de balances (17,18,19);30 de noviembre;;X;;;
1096;LOS NIÑOS DEL FUTURO;01/01/2005;2 BIS E/ 516 Y 517 S/Nº;TOLOSA;Desarrollo Humano y Solidaridad Social (en general);6;1901;;;;enero 19 de 2005;;En trámite;1544/05;57937/05;1221;;;;;MARTINEZ NORMA TEL: 471-0245;2005 ( declaración jurada de patrimonio );;;;X;;
1097;L.U.S.( LAZOS DE UNION Y SOLIDARIDAD );01/01/2005;144 Nº 1103;SAN CARLOS;Desarrollo Humano y Solidaridad Social (en general);4;1900;;;;mayo 7 de 2005;;En trámite;1547/05;63490/05;1222;;;;;VITALE CLOTILDE;2005 ( declaración jurada de patrimonio );;;;X;;
1098;BUENOS TIEMPOS;01/01/2008;71 Nº 723;C. URBANO SUR;Desarrollo Humano y Solidaridad Social (en general);9;1900;453-7704;lvitale@hotmail.com;;27 de Abril 2003;;L: 1/121323 / M: 26580;200/06;65684/05;1223;;;;;POLICANO ADRIANA TEL: 453-7704 / 154086528;2008 (Falta copia del acta de aprobación e informe de la Comisión Rev.);31 de diciembre;no;;X;;
1099;ASOCIACION CULTURAL PROCANTO POPULAR;01/01/2003;504 N° 2505 / 4 N° 270 P 6;GONNET;Promoción y Fomento;13;1897;;;;junio 11 de 1999;;L: 98098 / M: 19597;266/06;34918/05;1224;;;;;GUILLERMO MASSI TEL: 484-4159;2002-2003;30 de octubre;;;X;;
1100;DE CORAZON POR LOS NIÑOS;01/01/2005;56 N° 2830;LOS HORNOS;Desarrollo Humano y Solidaridad Social (en general);3;1941;;;;marzo 16 de 2004;;L: 127374 / M: 27860;272/06;51353/05;1226;;SI;;;RODRIGUEZ ESTELA TEL: 450-6676;2005 ( declaración jurada de patrimonio );16 de febrero;;;X;;
1101;CENTRO COMUNITARIO MILAGROS;01/01/2004;640 Y 147;LOS HORNOS;ASISTENCIA SOCIAL;3;1941;;;;junio 13 de 2005;;En trámite;;60311/05 - A la espera de la aprobación de la D.P.P.J;1227;;;;;CHUMBITA SILVIA GLADYS TEL: 15-5463062 Y 450 - 7938 (es de la mamá);2004 ( declaración jurada de patrimonio );;;;X;;
1102;TERCERA JUVENTUD DE VILLA CASTELLS;01/01/2005;12 Nº 4345 E/ 491 Y 492;GONNET;Actividades y terapias recreativas;13;1897;;;;mayo 5 de 2005;;En trámite;198/06;61096/05;1229;;;;;GODOY LUISA;2005 ( declaración jurada de patrimonio );31 de diciembre;no;;X;;
1103;ASOCIACION CIVIL DE FOMENTO SOCIAL CULTURAL Y DEPORTIVO QUIRON;01/01/2005;498 Nº 3273 E/ 27 Y 28;GONNET;Desarrollo Humano y Solidaridad Social (en general);13;1897;;;;marzo 28 de 2005;;L: 1/134921/M: 29291;201/06;61307/05;1230;;;;;DR. RODOLFO REZEK Y LAURINO TEL: 471-4002;2005 ( declaración jurada de patrimonio );28 de febrero;no;;X;;
1104;ASOCIACION VECINAL SAN JORGE;01/01/2005;519 Nº 2731 ESQ. 22;HERNANDEZ;Comedores;11;;;;;marzo 12 de 2005;;En trámite;199/06;63575/05;1231;;;;;CORDERO FRANCISCA  TEL: 471-2731;2005 ( declaración jurada de patrimonio );31 de diciembre;;;X;;
1105;CENTRO DE AMPARO CITY BELL;01/01/2016;466 E/ 19 Y 21;CITY BELL;Asistencia y Prevención;10;1896;;;;febrero 26 de 2002;;L: 113823 / M: 23938;268/06;66445/05;1232;;SI;;;PRASIVKA BEATRIZ 15 5016155/ 480-1868;2015-2016;28 de febrero;no;X;;2010;
1106;EL TRIUNFO;01/01/2005;59 Y 164;LOS HORNOS;SOCIAL;3;1941;;;;octubre 16 de 1991;;L: 59004 / M: 11000;371/06;65388/05;1233;;;;;ORTIZ ROSA TEL: 450-1887;2004-2005;;;;X;;
1107;GRUPO TERCERA EDAD LAS QUINTAS;01/01/2012;32 Nº 2067 E/ 136 Y 137;SAN CARLOS;Desarrollo Humano y Solidaridad Social (en general);4;1900;470-1562;;;febrero 15 de 1998;;L: 90859 / M: 17547;1962/05;69009/05;1237;;;;;ZULEMA MARTINEZ TEL: 470-1562 ???;2011-2012 DEBEN LOS INTERMEDIOS DESDE 2003-2004;31 de marzo;no;;X;;
1108;LA GRIETA Y BIBLIOTECA POPULAR LA CHICHARRA;01/01/2018;67 N° 1268 DTO. C;C. URBANO SUR;Centros Culturales;5;1900;;lagrietaylachicharra@gmail.com;;febrero 10 de 1999;;L: 96086 / M: 23114;271/06;66147/05;1238;;;;;Manuel Negrin (Pte) 221-6499529;2018;31 de marzo;CAMBIO DE DENOMINACION CON RESOL DJP DIC/12;X;;2010;
1109;JOVENES POR LA VIDA DE LA PLATA;01/01/2007;421 Nº 244;VILLA ELISA;Desarrollo Humano y Solidaridad Social (en general);12;1894;;;;marzo 25 de 2005;;L: 1/135463/M: 29385;269/06;63380/05;1239;;;;;BUSTOS NAVARTA OSCAR L. TEL: 473-0920;2007;31 de diciembre;;;X;;
1110;CENTRO DE LA 3º EDAD NUESTRA ESPERANZA;01/01/2010;125 E/ 604 Y 605;VILLA ELVIRA;CENTRO DE TERCERA EDAD;8;1900;;;;mayo 12 de 2005;;L: 137417 / M: 30169;1727/07;60310/05;1241;;;;;LENCINAS RAMOS ABEL TEL: 486-2324;2010;31 de diciembre;;X;;2011;
1111;HOGAR MATERNAL DE TRANSITO MIGUITAS DE PAN;01/01/2007;522 N° 195 E/ 117 Y 118;TOLOSA;Asistencia Infancia y Adolescencia;6;1906;;;;mayo 15 de 2003;;L: 121136 / M: 26592;267/06;19343/03;1242;;;;;TAMARA LOPEZ  TEL: 422-5204;2006-2007;31 de agosto;;;X;;
1112;TODO POR ELLOS;01/01/2005;25 E/ 85 Y 86;SAN LORENZO;Desarrollo Humano y Solidaridad Social (en general);5;1900;;;;diciembre 2 de 2005;;L:;241/06;71116/06;1243;;;;;GARNICA MARIO A.;2005 ( declaración jurada de patrimonio );;no;;X;;
1113;CLUB DEFENSORES DE CITY BELL;01/01/2004;476 E/ 2 Y 3;CITY BELL;Fútbol;10;1896;;;;diciembre 2 de 2001;;L: 113055 / M: 23657;279/06;72373/06;1244;;;;;GIMENEZ BORGES OSCAR TEL: 480-0696 / 154080863;2003-2004;2 de diciembre;;;X;;
1114;SOLSITO;01/01/2005;73 BIS E/ 142 Y 143;LOS HORNOS;SOCIAL;3;1941;;;;agosto 24 de 2005;;En trámite;;63489/05 - A la espera de la aprobación de la D.P.P.J;1245;;;;;LUNA CARLOS TEL: 456-2652;2005 ( declaración jurada de patrimonio );;;;X;;
1115;FORMAR PRINCIPIOS;01/01/2006;194 E/ 52 Y 53;OLMOS;Desarrollo Humano y Solidaridad Social (en general);7;;496-2651;;;octubre 1 de 2005;;L: 140377 / M: 30148;280/06;72372/06;1246;;;;;SANDOVAL MERCEDES TEL: 496-2651;2006 ( declaración jurada de patrimonio );17 de febrero;;;X;;
1116;10 DE ABRIL;01/01/2006;515 E/ 10 Y 11;RINGUELET;Social;6;1901;;;;febrero 8 de 2006;;L: 142012;141/07;74353/06;1247;;;;;APOLONIA HERMOSILLA;2006 ( declaración jurada de patrimonio );;;;X;;
1117;LOS MILONGUITAS Y BIBLIOTECA POPULAR;01/01/2005;77 Nº 811 E/ 11 Y 12;VILLA ELVIRA;Desarrollo Humano y Solidaridad Social (en general);8;1900;457-7959;;;mayo 15 de 2002;;L: 115357 / M: 24990;498/06;70752/05;1248;;;;;AURELIA GUTIERREZ TEL: 457-7959;2004-2005;;;;X;;
1118;LA OTRA PUERTA;01/01/2004;92 E/ 5 Y 6;VILLA ELVIRA;Asistencia Familiar;8;1900;;;;diciembre 8 de 2000;;L: 108416 / M: 22365;737/06;66547/05;1250;;;;;SANTELICES CARLOS A. TEL: 154-596640;2004;;;;X;;
1119;UNION TRANSITORIA DE CLUBES Y SOCIOS ROTARIOS -UNION TRANSITORIA DE EMPRESAS -;01/01/2005;39 N° 964 (Aclaró domicilio vía telefónica);C. URBANO ESTE;Asistencia y Fomento de Instituciones;;1900;;;;;;L:131.814 / M: 453 POR UNION TRANSITORIA;1033/06;82294/06;1251;;;;;JUAN CARLOS MARSIGLIA;2004 - 2005;;;;X;;
1120;ASOCIACION AFROBRASILERA AXE BOMBOXE DO XANGO;01/01/2006;503 E/ 8 Y 9;GONNET;Culto;13;1897;;;;octubre 7 de 2004;;L: 1/130276 / M: 28989;1244/06;73712/06;1253;;;;;MARTIN SERGIO M RUBEN;2006 ( declaración jurada de patrimonio );;;;X;;
1121;FUNDACION ARENAS ESPACIO DE ARTE, CIENCIA Y SALUD;01/01/2007;Diag. 73 nº 2573;C. URBANO SUR;Centros de Estudios;;1900;423-8053;;;octubre 19 de 2005;;1/139530-30228;1292/06;85340/06;1254;;;;;ROMERO MARISA TEL: 423-8053;2006-2007;28 de febrero;;;X;;
1122;ASOCIACION APOYO FAMILIAR CASA DEL NIÑO TIERRA NUEVA;01/01/2019;67 Nº 2046;C. URBANO SUR;Asistencia familiar;;1900;450-8922;;;marzo 19 de 2004;;1/118263/25666;0227/07;84099/06;1255;;SI;;;RAMOS SUSANA 457-3573;2019;31 de marzo;;X;;2010;
1123;LA COLONIA;01/01/2005;182 Y 448;ROMERO;De promoción y fomento;;;;;;marzo 1 de 2003;;L: 01/108648 M:25106;1450/06;87574/06;1256;;;;;ESPECHE FRANCISCO TEL: 491-4398;No hay balance porque la entidad se encontraba inactiva.(2005);;;;X;;
1124;CENTRO VECINAL BARRIO SAVOIA ( COMEDOR UNIDOS DE SAVOIA );01/01/2005;475 E/ 11 Y 12;CITY BELL;Comedores;10;1896;472-1955;;;marzo 12 de 1992;;L:1/60173 / M: 11156;1809/06;81053/06;1257;;SI;;;LILIANA VALLEJOS TEL: 472-0875;2005;31 de diciembre;;;X;;
1125;A.P.T.Y.E.R. ASOCIACION PACIENTES TRANSPLANTADOS Y ENFERMOS RENALES;01/01/2019;14 Nº 1631;C. URBANO SUR;Especialidades Médicas;;1900;;;;febrero 5 de 1996;;L: 1/80238 M: 15.636;47/07;98229/06;1263;;;;;JOSE LUIS BANEGAS -FARIAS ENRIQUE 425-5650;2019;27 de enero;;X;;2011;
1126;GRUPO EXPERIMENTA;01/01/2006;78 Nº 1841 E/131 Y 132;SAN LORENZO;Medio Ambiente;;1900;;;;25 de Abril 2005;;135205 M:30235;166/07;84886/06;1264;;;;;ANGELES DIEGO EMILIO (15) 4559540;2006 (declaración jurada de patrimonio);;;;X;;
1127;ASOCIACION APOYO FAMILIAR CASA DEL NIÑO CIELO AZUL;01/01/2010;2 BIS Nº 1697 E/ 515 BIS Y 516;RINGUELET;Desarrollo Humano y Solidaridad Social (en general);6;1901;;;;julio 2 de 2003;;L: 111770 / M: 23447;165/07;78006/06;1265;;SI;;;GASPORRI MARIA CECILIA;2009-2010 EL DOMICILIO DE 2 BIS ES EL NUEVO PERO NO ESTÁ REGISTRADO EN JURIDICAS, ALLI FIGURA 121 NRO 352;31 de marzo;;X;;2010;
1128;El MERCADITO;01/01/2005;119 Y 519 S/N;RINGUELET;Asistencia familiar;;1901;;;;diciembre 19 de 1995;;1/80562 M: 15619;312/07;84888/06;1266;;;;;CASTRO MARIA CLAUDIA;2005;;;;X;;
1129;CEFERINO NAMUNCURA;01/01/2019;96 nº571 e/ 6 y 7;C. URBANO ESTE;Capacidades diferentes en general;;1900;452-5403;;;mayo 10 de 1995;;L:76798 M: 15017;326/07;96254/06;1267;SI;;;;MIOTTI ALEJANDRA ELENA 4177380;2019;43312;;X;;;
1130;CENTRO DE LA TERCERA EDAD AMIGOS DE TACUARI;01/01/2015;64 Nº 1175 E/ 18 Y 19;C. URBANO ESTE;Actividades y terapias recreativas;;1900;;;;junio 29 de 2005;;L: 140938 / M: 30298;325/07;1590/07;1268;;;;;HUFAYZEN DORA REVISOR DE CTAS: MIRANDA ELSA 453-2955;2014-2015;30 de junio;;X;;;
1131;ESTIMULARTE;01/01/2009;135 Nº 1709 E/67 Y 68;LOS HORNOS;Capacidades diferentes;;1900;452-2988;estimularte_lp@hotmail.com;;marzo 20 de 2004;;L: 1/127501 M: 27660;436/07;87120/06;1269;;;;;SANDRA MAIRELA CHAVEZ GUTIERREZ TEL: 15-5387960/452-2988;2008-2009;30 de abril;;;X;;
1132;CENTRO CULTURAL LA PALANCA - TEATRO DE LA LUNA LLENA -;01/01/2008;14 E/ 501 Y CLUB UNIVERSITARIO;GONNET;Centros culturales;;1897;;gilsorialapalanca@hotmail.com;;julio 14 de 2000;;L: 1/105134 M: 21213;435/07;1154/07;1270;;;;;RICARDO GIL SORIA;2007-2008;30 de junio;;;X;;
1133;HOGAR INFANTIL BETHEL;01/01/2014;GUEMES Y 31 BIS;CITY BELL;Asistencia a la infancia y adolescencia;;1896;;;;mayo 27 de 2005;;L: 1/136049 M: 29402;439/07;94618/06;1271;;SI;;;KULAK BLADIMIR;2013-2014;25 de marzo;;;X;2011;
1134;ASOCIACION CIVIL ACCIONES Y COMPROMISOS;01/01/2005;81  Nº 1357 E/ 22 Y 23;SAN LORENZO;Promoción y Fomento;;1900;457-1485;;;julio 5 de 2004;;L: 129273;433/07;98647/06;1272;;;;;DIAZ MARIA GUILLERMINA TEL: 15-4881921;2005;31 de diciembre;;;X;;
1135;FUNDACION DE LA FACULTAD DE HUMANIDADES Y CIENCIAS DE LA EDUCACION DE LA U.N.L.P.;01/01/2008;48 E/ 6 Y 7 1° PISO;C. URBANO ESTE;Equipamiento e Infraestructura;;1900;;;;marzo 26 de 1992;;L: 1/61573 M: 11914;437/07;99319/06;1273;;;;;GRACIELA. C. DE COCOZZELLA;2007-2008;31 de agosto;;;X;;
1136;LOS CHICOS DE MI BARRIO DE TOLOSA;01/01/2005;122 E/ 527 Y 528 S/N°;TOLOSA;Asistencia Infancia y Adolescencia;;1906;;;;noviembre 25 de 2003;;L: 125669 M: 27407;561/07;1155/07;1274;;;;;CAMILLERI AZUCENA (TEL: 15-497-7707);2005;31 de diciembre;;;X;;
1137;ASOCIACION PLATENSE DE REHABILITACION (APLAR);01/01/2006;55 Nº 480 (VER DOMICILIO);C. URBANO SUR;Asistencia y Prevención;;1900;489 - 4747;aplar@argentina.com.ar;;mayo 12 de 2006;;143741-30858;563/07;86663/06;1275;;;;;BERLIN MAXIMILIANO 471-5705;2006 inicial;30 de junio;;;X;;
1138;CENTRO DE COMERCIO E INDUSTRIA Y PRODUCCION DE VILLA ELISA;01/01/2008;CON CENTENARIO E/ 48 Y 49;VILLA ELISA;Desarrollo Comercial y Productivo;;1894;;;;octubre 4 de 1971;;M: 4042;562/07;89167/06;1276;;;;;KNEZ RODOLFO. M. TEL: 15-5860234;2008;31 de diciembre;;;X;;
1139;ASOCIACION PRODUCTORES AVICOLAS DEL SUR;01/01/2005;RUTA 2 KM. 44,5 PARAJE EL PELIGRO;ABASTO;De promoción y fomento;;1903;    (02229) 497925;;;octubre 13 de 2005;;L:139589 M: 30160;559/07;;1277;;;;;MARTINS CHALAO WALTER;2005 (inicial);31 de diciembre;;;X;;
1140;JOVENES DE PIE;01/01/2005;423 BIS Nº 1701 E/ 18 Y 19;VILLA ELISA;SOCIAL;;1894;;;;diciembre 2 de 2004;;L: 133068 / M: 29295;560/07;76394/06;1278;;;;;RODOLFO A. URBANO TEL: 487-1197;2005 ( declaración jurada de patrimonio );31 de diciembre;;;X;;
1141;HOGAR ESPERANZA  DE VIDA;01/01/2009;86 Nº 905;VILLA ELVIRA;Atención Adicciones;;;;;;junio 15 de 1999;;L: 03/98160  M: 20236;788/07;098870/06;1279;;;;;PAREDES OSVALDO  TEL: 451-6730;2008-2009;31 de enero;;;X;;
1142;ASOCIACION CENTRO PARA LA NIÑEZ (ASO.CE.PA.NI);01/01/2006;50 Nº 1169 E/ 18 Y 19;C. URBANO NORTE;Asistencia Infancia y Adolescencia;;1900;452-0416;asocepani@yahoo.com.ar;;diciembre 24 de 2004;;L: 126473 / M: 27541;698/07;87904/06;1280;;;;;JORGE IMPERIALI  (TEL: 15-481-9727);2005-2006;3 de diciembre de 2004;;;X;;
1143;ASOCIACION BARRIAL LEALTAD;01/01/2006;29 Nº 1959 E/ 512 Y 512 BIS;HERNANDEZ;Comedores;11;;;;;septiembre 30 de 1997;;L: 88715 / M: 17374;;43522/04;1281;;;;;FIORINO AMELIA CLARA TEL: 484-5044;2005-2006;;;;X;;
1144;;01/01/2006;10 E/ 506 Y 507 CASA 34;GONNET;Promoción y Fomento;;1897;;;;julio del 2006;;L:01/115840 M: 30881;1521/07;94617/06;1282;;;;;TALLERICO ALEJANDRO;Declaración Jurada 2006 (Inicial);31 de diciembre;;;X;;
1145;FUNDACION EMMANUEL;01/01/2019;186 Y 474;ROMERO;Desarrollo Humano y Solidadridad Social en general;;;491-4555;e-mail: emmanuel@emmanuel.org.ar;;marzo 17 de 1986;;L: 84733 M: 16329;1357/07;5267/07;1283;SI;SI;;;GARCIA CLAUDIO- APODERADA LILIANA BASUALDO TEL 15 5944925;2019;30 de junio;;X;;2019;
1146;FUNDACION  JOSE MANUEL ESTRADA;01/01/2018;CANTILO S/Nº  E/ 4 Y 5;CITY BELL;Aprendizaje y Educación;10;1896;;;;octubre 18 de 1991;;L:1/58653 M: 10911;1466/07;11702/07;1284;;;;;ANA MARGARITA DE SALAS 480-2597;2018;31 de julio;X;X;;;
1147;CENTRO DE DIFUSION DE LA CELAQUIA (CE.DI.CE);01/01/2007;119 Nº 1643;C. URBANO ESTE;Salud y Bienestar Humano;;1900;15-5722670;ce_di_ce@yahoo.com.ar;;marzo 5 de 2005;;L: 149995 M: 32033;1467/07;10865/07;1285;;;;;POLI MARTA BEATRIZ TEL: 482-2136;2007 (Inicial);31 de marzo;;;X;;
